<?xml version="1.0" encoding="UTF-8"?>
<accessRegistry xnlns="http://skoona.net/SknServices/AccessRegistry"
                xmlns:xsi="http://www.w3.org/2001/XMLSchema-instance" 
                xsi:schemaLocation="http://skoona.net/SknServices/AccessRegistry access_registry.xsd">
<!--
   see: config/access_registry.xsd

					    -*-*-*-   Table of Contents  -*-*-*-
	 
	 * Menu Page Registry			    All pages accessable from a menu
	 * GLOBAL System Resources			Unsecured (login, logout, etc.)
	 
	 * GLOBAL User Pages 		        Unsecured (home )
	 * PROTECTED Task Links  			Secured Navigation Links.  (Create Account, Admin, etc.)

	 * Development Resources            Secured pages which show system activity or state

-->

    <!--============== RSpec Test Data  ========== -->
    <resource secured="false">
        <uri>testing/public</uri>
        <description>Unsecured or Public Resource. (Hash)</description>
        <userdata>drawerid:27655173|filetype:27635476|foldertype:27637844|doctype:955</userdata>
    </resource>
    <resource secured="false">
        <uri>testing/public_array</uri>
        <description>Unsecured or Public Resource. (Array)</description>
        <userdata>drawerid|filetype|foldertype|doctype</userdata>
    </resource>
    <resource secured="false">
        <uri>testing/public_string</uri>
        <description>Unsecured or Public Resource. (String)</description>
        <userdata>"value without vertical-bars or semi-colons will return as string"</userdata>
    </resource>

    <resource secured="true">
        <uri>testing/userdata</uri>
        <description>Secured Content Description (Hash)</description>
        <userdata>drawerid:27655173|filetype:27635476|foldertype:27637844|doctype:955</userdata>
        <permission type="READ">
            <authorizedRoles>
                <authorizedRole>Test.Action.Create</authorizedRole>
                <authorizedRole>Test.Action.Read</authorizedRole>
                <authorizedRole>Test.Action.Update</authorizedRole>
                <authorizedRole>Test.Action.Delete</authorizedRole>
            </authorizedRoles>
        </permission>
    </resource>

    <resource secured="true">
        <uri>testing/role/progressive</uri>
        <description>Testing Resource Only: Progressive Capability</description>
        <permission type="READ">
            <authorizedRoles>
                <authorizedRole>Test.Action.Create</authorizedRole>
                <authorizedRole>Test.Action.Read</authorizedRole>
                <authorizedRole>Test.Action.Update</authorizedRole>
                <authorizedRole>Test.Action.Delete</authorizedRole>
            </authorizedRoles>
        </permission>
        <permission type="UPDATE">
            <authorizedRoles>
                <authorizedRole>Test.Action.Update</authorizedRole>
                <authorizedRole>Test.Action.Create</authorizedRole>
                <authorizedRole>Test.Action.Delete</authorizedRole>
            </authorizedRoles>
        </permission>
        <permission type="CREATE">
            <authorizedRoles>
                <authorizedRole>Test.Action.Create</authorizedRole>
                <authorizedRole>Test.Action.Delete</authorizedRole>
            </authorizedRoles>
        </permission>
        <permission type="DELETE">
            <authorizedRoles>
                <authorizedRole>Test.Action.Delete</authorizedRole>
                <authorizedRole>Services.Action.Developer</authorizedRole>
            </authorizedRoles>
        </permission>
    </resource>

    <resource secured="true">
        <uri>testing/role/absolutes</uri>
        <description>Testing Resource Only: Absolute Capability</description>
        <permission type="READ">
            <authorizedRoles>
                <authorizedRole>Test.Action.Read</authorizedRole>
            </authorizedRoles>
        </permission>
        <permission type="UPDATE">
            <authorizedRoles>
                <authorizedRole>Test.Action.Update</authorizedRole>
            </authorizedRoles>
        </permission>
        <permission type="CREATE">
            <authorizedRoles>
                <authorizedRole>Test.Action.Create</authorizedRole>
            </authorizedRoles>
        </permission>
        <permission type="DELETE">
            <authorizedRoles>
                <authorizedRole>Test.Action.Delete</authorizedRole>
                <authorizedRole>Services.Action.Developer</authorizedRole>
            </authorizedRoles>
        </permission>
    </resource>

    <resource secured="true">
        <uri>testing/role/options</uri>
        <description>Testing Resource Only: Options Special Ownership Granting Capability</description>
        <permission type="READ">
            <authorizedRoles>
                <authorizedRole>Test.Action.Read</authorizedRole>
            </authorizedRoles>
        </permission>
        <permission type="UPDATE">
            <authorizedRoles>
                <authorizedRole options="OBJECT-OWNER">Test.Action.Read</authorizedRole>
                <authorizedRole>Test.Action.Update</authorizedRole>
            </authorizedRoles>
        </permission>
        <permission type="CREATE">
            <authorizedRoles>
                <authorizedRole options="CLIENT-MANAGER">Test.Action.Read</authorizedRole>
                <authorizedRole>Test.Action.Create</authorizedRole>
            </authorizedRoles>
        </permission>
        <permission type="DELETE">
            <authorizedRoles>
                <authorizedRole>Test.Action.Delete</authorizedRole>
                <authorizedRole>Services.Action.Developer</authorizedRole>
            </authorizedRoles>
        </permission>
    </resource>


    <!--============================================================================= -->
    <!--========================= RESOURCE REGISTRY  ================================ -->
    <!--============================================================================= -->

    <!--============== System Menu  ========== -->
    <resource secured="true">
        <uri>#Management</uri>
        <description>Management Menu</description>
        <permission type="READ">
            <authorizedRoles>
                <authorizedRole>Services.Action.Admin</authorizedRole>
                <authorizedRole>Services.Action.Developer</authorizedRole>
                <authorizedRole>Services.Action.Admin.UserRecords</authorizedRole>
            </authorizedRoles>
        </permission>
    </resource>
    <resource secured="true">
        <uri>#UserProfileManagement</uri>
        <description>Authentication Admin</description>
        <permission type="READ">
            <authorizedRoles>
                <authorizedRole>Services.Action.Admin</authorizedRole>
                <authorizedRole>Services.Action.Developer</authorizedRole>
                <authorizedRole>Services.Action.Admin.UserRecords</authorizedRole>
            </authorizedRoles>
        </permission>
    </resource>
    <resource secured="true">
        <uri>#AccessProfileManagement</uri>
        <description>AccessProfile Admin</description>
        <permission type="READ">
            <authorizedRoles>
                <authorizedRole>Services.Action.Admin</authorizedRole>
                <authorizedRole>Services.Action.Developer</authorizedRole>
                <authorizedRole>Services.Action.Admin.UserAuthorizationGroups</authorizedRole>
            </authorizedRoles>
        </permission>
    </resource>
    <resource secured="true">
        <uri>#ContentProfileManagement</uri>
        <description>ContentProfile Admin</description>
        <permission type="READ">
            <authorizedRoles>
                <authorizedRole>Services.Action.Admin</authorizedRole>
                <authorizedRole>Services.Action.Developer</authorizedRole>
                <authorizedRole>Services.Action.Admin.ContentProfile</authorizedRole>
            </authorizedRoles>
        </permission>
    </resource>
    <resource secured="true">
        <uri>#Demonstration</uri>
        <description>Content Profile In Action</description>
        <permission type="READ">
            <authorizedRoles>
                <authorizedRole>Services.Action.Admin</authorizedRole>
                <authorizedRole>Services.Action.Developer</authorizedRole>
                <authorizedRole>Services.Action.Admin.ContentProfile</authorizedRole>
            </authorizedRoles>
        </permission>
    </resource>
    <resource secured="true">
        <uri>#SystemInformation</uri>
        <description>Current Application State/Status</description>
        <permission type="READ">
            <authorizedRoles>
                <authorizedRole>Services.Action.Admin</authorizedRole>
                <authorizedRole>Services.Action.Developer</authorizedRole>
                <authorizedRole>Services.Action.Admin.ContentProfile</authorizedRole>
            </authorizedRoles>
        </permission>
    </resource>


    <!--============== Profiles Pages  ========== --> profiles/accessible_content
    <resource secured="true">
        <uri>profiles/api_accessible_content</uri>
        <description>AccessibleContent API.JSON</description>
        <permission type="READ">
            <authorizedRoles>
                <authorizedRole>Services.Action.Admin</authorizedRole>
                <authorizedRole>Services.Action.Developer</authorizedRole>
            </authorizedRoles>
        </permission>
    </resource>

    <resource secured="true">
        <uri>profiles/content_profile_demo</uri>
        <description>ContentProfile In Action</description>
        <permission type="READ">
            <authorizedRoles>
                <authorizedRole>Services.Action.Admin</authorizedRole>
                <authorizedRole>Services.Action.Developer</authorizedRole>
                <authorizedRole>Services.Action.Admin.ContentProfile</authorizedRole>
            </authorizedRoles>
        </permission>
    </resource>